File;ORM_check;ORM_invited_or_challange;IRM_check;IRM_invited_or_challange;Folder;ID;Start Date;End Date;Process Category;Tribe;Type
;;;;;Digital Sales/Consumer Loans/2022-09-15 Care je lening staat klaar (verbouwen);1008;2022-09-15 00:00:00;2024-07-11 00:00:00;Communication;Tribe Digital & Customer Interactions;Change
;;;;;Doorlopend Krediet/Studentenkrediet/2022-09-23 Simplify Loans products (Cancel Student Loan);1037;2022-09-23 00:00:00;2024-10-30 00:00:00;Significant change financial product/-service/channel (PAP);Consumer Lending & Insurance;Change
;;;;;Payments_Giraal betvk/iDEAL 2.0/2022-09-29 iDEAL 2.0 Release 3 Acquiring;1050;2022-09-29 00:00:00;2024-04-08 00:00:00;Significant change financial product/-service/channel (PAP);Tribe Payments;Change
;;;;;Beleggingsrekeningen/Vermogensbeheer/2022-09-30 Aanpassing revisie beleid en online revisie flow Vermogensbeheer;1060;2022-09-30 00:00:00;2024-03-28 00:00:00;Other change (non-PAP);Tribe Investments;Change
;;;;;Payments Cards Issuing/Betaalpas zakelijk (cards issuing)/2022-10-04 Soft block business (AppMINGZ);1068;2022-10-04 00:00:00;2024-02-07 00:00:00;Other change (non-PAP);Tribe Payments;Change
;;;;;Private Banking _ Wealth/Campagnes/2022-10-05 Award campaign ING Private Banking 2022;1070;2022-10-05 00:00:00;2024-01-03 00:00:00;Communication;Private Banking & Wealth Mgt (Advice);Change
;;;;;Persoonlijke Lening/Persoonlijke Lening/2022-10-11 Transactional scorecard NL for internal ING customers  EPIC0081965;1100;2022-10-11 00:00:00;2025-04-15 00:00:00;Risk assessment (non-PAP);Consumer Lending & Insurance;Change
;;;;;Digital Sales/Z_Other/2024 -10-28 Linkbuilding;1117;2022-10-18 00:00:00;2024-10-31 00:00:00;Communication;Tribe Digital & Customer Interactions;Change
;;;;;Beleggingsrekeningen/Beleggen App/2022-11-22 Small CX improvements in the Mobile Investments App;1211;2022-11-22 00:00:00;2024-04-11 00:00:00;Communication;Tribe Investments;Change
;;;;;Payments_Giraal betvk/Betaalverzoek/2022-11-23 TC update BB  for PR Zakelijk;1216;2022-11-23 00:00:00;2024-04-03 00:00:00;Other change (non-PAP);Tribe Payments;Change
;;;;;Current accounts/Kinderrekening/2022-11-24 Zakgeldpropositie pilot;1219;2022-11-24 00:00:00;2024-10-01 00:00:00;Other change (non-PAP);Tribe Daily Banking & Digital First;Change
;;;;;Hypotheken/Z_Other/2022-11-28 ToolingPEGASMVINGHuizen;1225;2022-11-28 00:00:00;2024-01-22 00:00:00;Risk assessment (non-PAP);Tribe Mortgages;Change
;;;;;Hypotheken/Z_Other/2022-11-28 Communication regarding solving Data Quality issues;1227;2022-11-28 00:00:00;2024-02-28 00:00:00;Communication;Tribe Mortgages;Change
;;;;;Beleggingsrekeningen/Vermogensbeheer/2022-12-06 Change box 3 taxes article;1254;2022-12-06 00:00:00;2024-03-28 00:00:00;Other change (non-PAP);Tribe Investments;Change
;;;;;Business Banking Services and Products/Digitale handtekening/2022-12-21 Digital signature Business Banking DBNL;1294;2022-12-21 00:00:00;2024-08-13 00:00:00;New financial product/-service/channel (PAP);Business Banking Sales;Change
;;;;;Beleggingsrekeningen/Eenvoudig Beleggen/2023-01-11 Easy Invest  NL  Improve onboarding conversion during 2023  Front End;1351;2023-01-11 00:00:00;2024-09-06 00:00:00;Communication;Tribe Investments;Change
;;;;;Credit Cards/Creditcard/2023-01-12 Decom Polymer EPIC010278;1358;2023-01-12 00:00:00;2024-02-27 00:00:00;Other change (non-PAP);Tribe Payments;Change
;;;;;ORM 2 LOD Processes & Systems/Other/2023-01-13 Handover maintenance SPIDER Tooling to ING HUB Sourcing Manila;1361;2023-01-13 00:00:00;2024-09-13 00:00:00;Risk assessment (non-PAP);Tribe NFR;Change
;;;;;Digital Sales/Insurance/2023-01-16 Direct flow link;1364;2023-01-16 00:00:00;2024-07-09 00:00:00;Communication;Tribe Digital & Customer Interactions;Change
;;;;;Digital Sales/Digital Touchpoints/2023-01-31 First party customer identifiers collection via Adobe Experience suite;1426;2023-01-31 00:00:00;2024-07-09 00:00:00;Other change (non-PAP);Tribe Digital & Customer Interactions;Change
;;;;;Z_Other/Tribe Digital & Customer Interactions/2023-01-31 Decomm Mobile Legacy backend;1430;2023-01-31 00:00:00;2024-07-09 00:00:00;Other change (non-PAP);Tribe Digital & Customer Interactions;Change
;;;;;Beleggingsrekeningen/Zelf op de Beurs/2023-02-03 Distributor Due Dilligence Tooling;1436;2023-02-03 00:00:00;2024-04-12 00:00:00;Other change (non-PAP);Tribe Investments;Change
;;;;;Z_Other/Consumer Lending & Insurance/2023-02-03 GrossNet tool;1437;2023-02-03 00:00:00;2024-02-20 00:00:00;Other change (non-PAP);Consumer Lending & Insurance;Change
;;;;;Payments_Giraal betvk/Z_Other/2023-02-06 EPIC0095528 LABC Corebank;1440;2023-02-06 00:00:00;2024-03-12 00:00:00;Risk assessment (non-PAP);Tribe Payments;Change
;;;;;Payments Cards Issuing/Betaalpas particulier (cards issuing)/2023-02-08 Shift debit card processes from Branch to CSNL;1446;2023-02-08 00:00:00;2024-02-26 00:00:00;Risk assessment (non-PAP);Tribe Payments;Change
;;;;;Customer IT Systems & Processes/Process change/2023-02-09 InApp conversations;1451;2023-02-09 00:00:00;2024-10-07 00:00:00;Risk assessment (non-PAP);Tribe Assisted Channels;Change
;;;;;Customer Data/Process change/2023-02-13 Refinement Parental Power process;1455;2023-02-13 00:00:00;2024-05-02 00:00:00;Risk assessment (non-PAP);Tribe Digital Business Banking;Change
;;;;;Payments_Giraal betvk/SEPA CT (MING en app, enkel_mv en ink)/2023-02-13 Redesign of Move Money;1456;2023-02-13 00:00:00;2024-04-03 00:00:00;Risk assessment (non-PAP);Tribe Payments;Change
;;;;;Payments Mobile Payments/Mobiel Betalen/2023-08-07 Go live wearables Garmin;1465;2023-08-07 00:00:00;2024-04-08 00:00:00;Risk assessment (non-PAP);Tribe Payments;Change
;;;;;Payments Acquiring/New product/2023-02-15 Ecom Business Banking;1466;2023-02-15 00:00:00;2024-03-12 00:00:00;New financial product/-service/channel (PAP);Tribe Payments;Change
;;;;;Persoonlijke Lening/Persoonlijke Lening/2021-11-03 Instant lendingOckto EPIC0081949/9. UWV data business rules/Change after go-live;1470;2023-02-16 00:00:00;2025-04-16 00:00:00;Risk assessment (non-PAP);Consumer Lending & Insurance;Change
;;;;;Beleggingsrekeningen/Eenvoudig Beleggen/2023-02-16 Reson to sell Easy Invest NL;1471;2023-02-16 00:00:00;2024-04-11 00:00:00;Other change (non-PAP);Tribe Investments;Change
;;;;;Payments Mobile Payments/Mobiel Betalen/2023-02-16 VTS implementation;1474;2023-02-16 00:00:00;2024-03-12 00:00:00;Risk assessment (non-PAP);Tribe Payments;Change
;;;;;Digital Sales/Current accounts/2023-02-17 Recognize parents  test 5;1477;2023-02-17 00:00:00;2024-07-16 00:00:00;Communication;Tribe Digital & Customer Interactions;Change
;;;;;Payments Cards Issuing/Betaalpas particulier (cards issuing)/2023-02-17 BR removal of the Ringfencing Marking;1478;2023-02-17 00:00:00;2024-03-05 00:00:00;Risk assessment (non-PAP);Tribe Payments;Change
;;;;;Customer Intelligence/Datamart/2023-03-07 DMCAN migration Exadata;1508;2023-03-07 00:00:00;2024-10-22 00:00:00;Risk assessment (non-PAP);Tribe Digital & Customer Interactions;Change
;;;;;Z_Other/Tribe Daily Banking & Digital First/2023-03-16 Mobile Onboarding  Legal Representative;1533;2023-03-16 00:00:00;2024-04-26 00:00:00;Risk assessment (non-PAP);Tribe Daily Banking & Digital First;Change
;;;;;KYC/Process change/2023-03-22 Record Retention PEGA KYC SoR;1547;2023-03-22 00:00:00;2024-10-29 00:00:00;Risk assessment (non-PAP);Tribe KYC Services;Change
;;;;;Persoonlijke Lening/Persoonlijke Lening/2023-03-24 Sourcing CL L2C processing applications;1553;2023-03-24 00:00:00;2025-04-05 00:00:00;Risk assessment (non-PAP);Consumer Lending & Insurance;Change
;;;;;Customer Data/Process change/2023-03-28 Duurzaamheidsscan MingZ;1566;2023-03-28 00:00:00;2025-02-14 00:00:00;Other change (non-PAP);Tribe Digital Business Banking;Change
;;;;;Lenen zakelijk/Z_Other/2023-03-31 Instant Lending;1580;2023-03-31 00:00:00;2024-02-27 00:00:00;Significant change financial product/-service/channel (PAP);Tribe Business Lending;Change
;;;;;Persoonlijke Lening/Persoonlijke Lening/2023-03-31 Removal death waiver;1582;2023-03-31 00:00:00;2024-10-31 00:00:00;Significant change financial product/-service/channel (PAP);Consumer Lending & Insurance;Change
;;;;;KYC/Policy change/2023-03-31 Use of IVR registrations for coffeeshops  for Increased UHRCcompliance risks customers;1584;2023-03-31 00:00:00;2024-11-01 00:00:00;Other change (non-PAP);Tribe KYC Services;Change
;;;;;Beleggingsrekeningen/Zelf op de Beurs/2023-04-03 Exante kostentransparantie d.m.v. Maatmensen;1587;2023-04-03 00:00:00;2024-04-11 00:00:00;Communication;Tribe Investments;Change
;;;;;Beleggingsrekeningen/Zelf op de Beurs/2023-04-05 Overview of art.9 funds in MIA;1594;2023-04-05 00:00:00;2024-04-11 00:00:00;Communication;Tribe Investments;Change
;;;;;Private Banking _ Wealth/Internetpagina/2023-04-06 Rebuild PriBa website;1599;2023-04-06 00:00:00;2025-01-22 00:00:00;Risk assessment (non-PAP);Private Banking & Wealth Mgt (Advice);Change
;;;;;Commercial Finance/Other/2023-04-13 Docbox  pilot for Blend;1611;2023-04-13 00:00:00;2024-09-17 00:00:00;Other change (non-PAP);Commercial Finance;Change
;;;;;Private Banking _ Wealth/Campagnes/2023-04-13 Swingnature;1613;2023-04-13 00:00:00;2024-03-28 00:00:00;Risk assessment (non-PAP);Private Banking & Wealth Mgt (Advice);Change
;;;;;Payments Mobile Payments/Mobiel Betalen/2023-04-17 Google Pay;1621;2023-04-17 00:00:00;2024-03-12 00:00:00;Significant change financial product/-service/channel (PAP);Tribe Payments;Change
;;;;;Lenen zakelijk/Z_Other/2023-04-18 Climate Risk Assessment;1627;2023-04-18 00:00:00;2024-02-28 00:00:00;Risk assessment (non-PAP);Tribe Business Lending;Change
;;;;;Z_Other/Tribe Daily Banking & Digital First/2023-04-19 Check je zorgtoeslag;1632;2023-04-19 00:00:00;2024-10-02 00:00:00;Communication;Tribe Daily Banking & Digital First;Change
;;;;;Persoonlijke Lening/Persoonlijke Lening/2023-04-21 Implementing consolidation flow;1644;2023-04-21 00:00:00;2024-11-19 00:00:00;New financial product/-service/channel (PAP);Consumer Lending & Insurance;Change
;;;;;Z_Other/Consumer Lending & Insurance/2023-04-21 Extending Smart Calculator with MLA calculation;1645;2023-04-21 00:00:00;2024-11-19 00:00:00;Risk assessment (non-PAP);Consumer Lending & Insurance;Change
;;;;;Persoonlijke Lening/Persoonlijke Lening/2023-05-03 2nd contr holder CLT warning for Restr Loan  Fin Fit Loan;1671;2023-05-03 00:00:00;2024-10-30 00:00:00;Other change (non-PAP);Consumer Lending & Insurance;Change
;;;;;Persoonlijke Lening/Persoonlijke Lening/2023-05-04 PSD2 Apply Flow Consumer Loans;1674;2023-05-04 00:00:00;2024-10-31 00:00:00;Significant change financial product/-service/channel (PAP);Consumer Lending & Insurance;Change
;;;;;Beleggingsrekeningen/Eenvoudig Beleggen/2023-05-04 Eenvoudig Beleggen engagement optimalisatie;1676;2023-05-04 00:00:00;2024-05-23 00:00:00;Communication;Tribe Investments;Change
;;;;;Fraud/Process change/2023-05-15 Interactive Notifications;1706;2023-05-15 00:00:00;2024-04-18 00:00:00;Risk assessment (non-PAP);Tribe Fraud & Cyber Security;Change
;;;;;Digital Sales/Investments - Verdi/2023-05-15 Link to SU on additional investment pages;1708;2023-05-15 00:00:00;2024-07-09 00:00:00;Communication;Tribe Digital & Customer Interactions;Change
;;;;;Cash/Z_Other/2023-05-16 Decomission assisted cash services;1713;2023-05-16 00:00:00;2024-01-11 00:00:00;Termination of financial product/-service/channel (PAP);Tribe Payments;Change
;;;;;Digital Sales/Digital Touchpoints/2023-05-22 RTCDP matching variable phone number;1725;2023-05-22 00:00:00;2024-07-09 00:00:00;Other change (non-PAP);Tribe Digital & Customer Interactions;Change
;;;;;Payments Reporting/Afschriften (papier)/2023-05-25 Stop daily and weekly paper statements for private individuals;1734;2023-05-25 00:00:00;2024-03-13 00:00:00;Other change (non-PAP);Tribe Payments;Change
;;;;;Beleggingsrekeningen/Eenvoudig Beleggen/2023-05-25 Awareness and consideration campaign;1737;2023-05-25 00:00:00;2024-04-11 00:00:00;Communication;Tribe Investments;Change
;;;;;Z_Other/Tribe Digital & Customer Interactions/2023-05-30 SAE Update;1744;2023-05-30 00:00:00;2024-07-11 00:00:00;Risk assessment (non-PAP);Tribe Digital & Customer Interactions;Change
;;;;;Sustainability/Other/2023-05-31 2023NCFG;1745;2023-05-31 00:00:00;2024-05-31 00:00:00;Risk assessment (non-PAP);CoE Sustainability;Change
;;;;;Credit Cards/Creditcard/2023-05-31 Positive balances on closed credit card accounts (VIA);1746;2023-05-31 00:00:00;2024-02-27 00:00:00;Risk assessment (non-PAP);Tribe Payments;Change
;;;;;Persoonlijke Lening/Persoonlijke Lening/2022 - Instant Lending_Models/RIDM_Income/2023-13-04 Instant Lending changes Q2Q3;1751;2023-05-31 00:00:00;2024-11-19 00:00:00;Risk assessment (non-PAP);Consumer Lending & Insurance;Change
;;;;;Betalen-Roodstand/ING Rood Staan voor studenten/2023-06-05 Sales Stop ING Rood Staan voor studenten July 2023;1760;2023-06-05 00:00:00;2024-11-19 00:00:00;Communication;Consumer Lending & Insurance;Change
;;;;;Current accounts/Zakelijke rekening/2023-06-05 Four Eyes principle opening business account;1761;2023-06-05 00:00:00;2024-10-01 00:00:00;Risk assessment (non-PAP);Tribe Daily Banking & Digital First;Change
;;;;;Payments_Giraal betvk/Z_Other/2023-06-06 NextGen Sepa Rulebook wijzigingen 20232025;1769;2023-06-06 00:00:00;2024-04-08 00:00:00;Risk assessment (non-PAP);Tribe Payments;Change
;;;;;Doorlopend Krediet/Z_Other/2023-06-07 risklog update Lapwing Q2 2023;1772;2023-06-07 00:00:00;2024-01-08 00:00:00;Risk assessment (non-PAP);Consumer Lending & Insurance;Change
;;;;;KYC/Organisational change/2023-06-08 KYC Tribe extention - Process Design Specialists/0 - Risk Journey Tool;1776;2023-06-08 00:00:00;2024-10-29 00:00:00;Risk assessment (non-PAP);Tribe KYC Services;Change
;;;;;Beleggingsrekeningen/Zelf op de Beurs/2023-06-09 ACE Zelf op de Beurs;1779;2023-06-09 00:00:00;2024-09-06 00:00:00;Communication;Tribe Investments;Change
;;;;;Fraud/Process change/2023-06-13 Behavioral analytics on web;1786;2023-06-13 00:00:00;2024-03-21 00:00:00;Risk assessment (non-PAP);Tribe Fraud & Cyber Security;Change
;;;;;Fraud/Other/2023-10-24 Police report secure document upload;1791;2023-10-24 00:00:00;2024-02-13 00:00:00;Risk assessment (non-PAP);Tribe Fraud & Cyber Security;Change
;;;;;Beleggingsrekeningen/Beleggen App/2023-06-20 Periodic Fund Ordering MIApp;1806;2023-06-20 00:00:00;2024-09-13 00:00:00;Other change (non-PAP);Tribe Investments;Change
;;;;;Beleggingsrekeningen/Vermogensbeheer/2023-06-22 SFDR changes 2023;1811;2023-06-22 00:00:00;2024-04-11 00:00:00;Communication;Tribe Investments;Change
;;;;;Betalen-Roodstand/Continu Limiet voor ex-studenten/2023-06-22 Limit reduction and ending Continu Limieten exstudents;1812;2023-06-22 00:00:00;2024-03-07 00:00:00;Risk assessment (non-PAP);Consumer Lending & Insurance;Change
;;;;;Hypotheken - WUB/Z_Other/2023-06-27 ECB IO  Beleid Omzetten en Verlengen;1820;2023-06-27 00:00:00;2024-01-10 00:00:00;Other change (non-PAP);Tribe Mortgages;Change
;;;;;Beleggingsrekeningen/Beleggen App/2023-06-28 Makeathon 2023  Share portfolio for Self Invest;1826;2023-06-28 00:00:00;2024-04-11 00:00:00;Other change (non-PAP);Tribe Investments;Change
;;;;;Payments_Giraal betvk/SEPA Direct Debit (credit en debit)/2023-07-03 Refund fee;1841;2023-07-03 00:00:00;2024-04-03 00:00:00;Other change (non-PAP);Tribe Payments;Change
;;;;;Hypotheken/Z_Other/2023-07-04 HDN Bridge;1847;2023-07-04 00:00:00;2024-03-21 00:00:00;Risk assessment (non-PAP);Tribe Mortgages;Change
;;;;;Digital Sales/Mortgages/2023-07-04 Woningwaardetool starters;1848;2023-07-04 00:00:00;2024-07-09 00:00:00;Communication;Tribe Digital & Customer Interactions;Change
;;;;;Hypotheken/Z_Other/2023-07-05 Skip salary slip within origination process;1853;2023-07-05 00:00:00;2024-05-14 00:00:00;Risk assessment (non-PAP);Tribe Mortgages;Change
;;;;;Lenen zakelijk/Z_Other/2023-07-10 EWS suppression rules;1859;2023-07-10 00:00:00;2024-02-28 00:00:00;Risk assessment (non-PAP);Tribe Business Lending;Change
;;;;;Hypotheken - WUB/Z_Other/2023-07-11 MijnWUB Bouwdepot;1865;2023-07-11 00:00:00;2024-01-22 00:00:00;Other change (non-PAP);Tribe Mortgages;Change
;;;;;Collections/Process change/2023-07-11 DCA vierkantstelling;1867;2023-07-11 00:00:00;2024-12-13 00:00:00;Other change (non-PAP);Tribe Collections;Change
;;;;;C:/Users/TO60OF/ING/Product Evaluation and Risk Assessment Library (PEARL) - Documents/Pearl_Repository/Z_Other/Consumer Lending & Insurance/2023-07-11 Implement SDD for Loans;1871;2023-07-11 00:00:00;2024-10-31 00:00:00;Significant change financial product/-service/channel (PAP);Consumer Lending & Insurance;Change
;;;;;Lease/Process change/2023-07-12 RDW aan  afmelden;1873;2023-07-12 00:00:00;2024-04-25 00:00:00;Other change (non-PAP);Lease;Change
;;;;;Z_Other/Consumer Lending & Insurance/2023-07-12 Loannorm Update 2023;1874;2023-07-12 00:00:00;2024-01-08 00:00:00;Other change (non-PAP);Consumer Lending & Insurance;Change
;;;;;Hypotheken/Z_Other/2023-07-13 Construction deposit improvements  rationalisation;1878;2023-07-13 00:00:00;2024-05-28 00:00:00;Risk assessment (non-PAP);Tribe Mortgages;Change
;;;;;Lenen zakelijk/Z_Other/2023-07-17 Know Your Customer Automation in Blend;1884;2023-07-17 00:00:00;2024-04-29 00:00:00;Risk assessment (non-PAP);Tribe Business Lending;Change
;;;;;Customer IT Systems & Processes/Process change/2023-07-25 Gen AI enabled chatbot NL;1910;2023-07-25 00:00:00;2024-12-17 00:00:00;Significant change financial product/-service/channel (PAP);Tribe Assisted Channels;Change
;;;;;Hypotheken/Z_Other/2023-07-25 Approve TRA in MING;1912;2023-07-25 00:00:00;2024-02-20 00:00:00;Risk assessment (non-PAP);Tribe Mortgages;Change
;;;;;Current accounts/Kinderrekening/2023-07-26 Rewrite Productpages Child Account and Youth Account;1915;2023-07-26 00:00:00;2024-10-01 00:00:00;Communication;Tribe Daily Banking & Digital First;Change
;;;;;Customer Data/Process change/2023-07-26 Mobile Onboarding  Business Banking;1917;2023-07-26 00:00:00;2024-03-29 00:00:00;Other change (non-PAP);Tribe Digital Business Banking;Change
;;;;;Z_Other/Tribe Daily Banking & Digital First/2023-07-26 100 propositions Gen Z  Awareness phase;1920;2023-07-26 00:00:00;2024-10-17 00:00:00;Communication;Tribe Daily Banking & Digital First;Change
;;;;;Payments Acquiring/Digitaliseren POS Acquiring/2023-07-31 Digitaliseren InLife management POS Acquiring;1928;2023-07-31 00:00:00;2024-11-22 00:00:00;Risk assessment (non-PAP);Tribe Payments;Change
;;;;;Customer IT Systems & Processes/Other/2023-07-31 3328650 Manage Financial Overview from the App;1930;2023-07-31 00:00:00;2024-10-07 00:00:00;Other change (non-PAP);Tribe Assisted Channels;Change
;;;;;Verzekeren/ING Woonverzekering/2023-07-31 Increase rebuild value to 1mln;1932;2023-07-31 00:00:00;2024-12-09 00:00:00;Other change (non-PAP);Consumer Lending & Insurance;Change
;;;;;Lenen zakelijk/Z_Other/2023-08-02 HRCK Legacy deviation from solution in MIA ISSUE10057771 (new version);1942;2023-08-02 00:00:00;2024-03-13 00:00:00;Other change (non-PAP);Tribe Business Lending;Change
;;;;;Digital Sales/Personalization/2023-08-04 Priority Messages;1955;2023-08-04 00:00:00;2025-04-08 00:00:00;Communication;Tribe Digital & Customer Interactions;Change
;;;;;C:/Users/WW20AQ/ING/Product Evaluation and Risk Assessment Library (PEARL) - Documents/Pearl_Repository/Current accounts/Kinderrekening/2023-08-04 Child account plus orange savings account;1962;2023-08-04 00:00:00;2025-02-21 00:00:00;Significant change financial product/-service/channel (PAP);Tribe Daily Banking & Digital First;Change
;;;;;Credit Cards/Commercial Credit Cards/2023-08-08 CommercialCardsOverview;1968;2023-08-08 00:00:00;2024-02-02 00:00:00;Other change (non-PAP);Tribe Payments;Change
;;;;;Verzekeren/Z_Other/2023-08-08 Adjustment of the claim pages;1970;2023-08-08 00:00:00;2025-02-24 00:00:00;Communication;Consumer Lending & Insurance;Change
;;;;;Hypotheken - WUB/Z_Other/2023-08-09 Customer approach Interest Only Stater;1972;2023-08-09 00:00:00;2024-04-25 00:00:00;Risk assessment (non-PAP);Tribe Mortgages;Change
;;;;;Verzekeren/Business Zekerheidspakket/2023-08-09 Campaign 3 months free general liability;1974;2023-08-09 00:00:00;2024-04-10 00:00:00;Communication;Consumer Lending & Insurance;Change
;;;;;Z_Other/Tribe Business Lending/2023-08-10 ComplyExplain for Partnerfinancieringen;1981;2023-08-10 00:00:00;2024-03-12 00:00:00;Other change (non-PAP);Tribe Business Lending;Change
;;;;;Beleggingsrekeningen/Beleggen App/2023-08-14 Instrument details in the Mobile Banking App;1991;2023-08-14 00:00:00;2024-03-14 00:00:00;Other change (non-PAP);Tribe Investments;Change
;;;;;Beleggingsrekeningen/Eenvoudig Beleggen/2023-08-17 Easy Invest Call2Growth  DVT;2002;2023-08-17 00:00:00;2024-12-17 00:00:00;Significant change financial product/-service/channel (PAP);Tribe Investments;Change
;;;;;Customer IT Systems & Processes/Process change/2023-08-22 NonFTF complaints to Iris;2012;2023-08-22 00:00:00;2024-10-31 00:00:00;Other change (non-PAP);Tribe Assisted Channels;Change
;;;;;Verzekeren/Z_Other/2023-08-22 Explanation of insurance renewal;2013;2023-08-22 00:00:00;2024-03-28 00:00:00;Communication;Consumer Lending & Insurance;Change
;;;;;Lenen zakelijk/Z_Other/2023-08-23 Climate Risk Assessment full implementation;2015;2023-08-23 00:00:00;2024-07-05 00:00:00;Other change (non-PAP);Tribe Business Lending;Change
;;;;;Branding/Other/2023-08-31 Seaters;2039;2023-08-31 00:00:00;2024-08-02 00:00:00;Risk assessment (non-PAP);CoE Communications & Brand Experience;Change
;;;;;Private Banking _ Wealth/Z_Other/2023-09-04 04092023 Specials;2043;2023-09-04 00:00:00;2024-01-03 00:00:00;Risk assessment (non-PAP);Private Banking & Wealth Mgt (Advice);Change
;;;;;Lenen zakelijk/Z_Other/2023-09-04 Extended Covenant Monitoring;2048;2023-09-04 00:00:00;2024-01-17 00:00:00;Other change (non-PAP);Tribe Business Lending;Change
;;;;;Digital Sales/Mortgages/2023-09-05 Stop prefill funda Monthly Cost Indicator (MLI);2050;2023-09-05 00:00:00;2024-08-12 00:00:00;Communication;Tribe Digital & Customer Interactions;Change
;;;;;Lenen zakelijk/Z_Other/2023-09-06 PARP BLEND Credit Offer;2061;2023-09-06 00:00:00;2024-11-28 00:00:00;Communication;Tribe Business Lending;Change
;;;;;Digital Sales/Personalization/2023-09-06 New Insights  Total Flows InOut of current account;2063;2023-09-06 00:00:00;2024-07-15 00:00:00;Communication;Tribe Digital & Customer Interactions;Change
;;;;;Digital Sales/Personalization/2023-09-06 New Insights  Savings related progress;2064;2023-09-06 00:00:00;2024-07-16 00:00:00;Communication;Tribe Digital & Customer Interactions;Change
;;;;;Digital Sales/Personalization/2023-09-06 New Insights  Engagement Feature Magician Mode;2065;2023-09-06 00:00:00;2024-07-15 00:00:00;Communication;Tribe Digital & Customer Interactions;Change
;;;;;Credit Cards/Commercial Credit Cards/2023-09-08 Add automated BKR check on output PDF CLT;2071;2023-09-08 00:00:00;2024-02-02 00:00:00;Other change (non-PAP);Tribe Payments;Change
;;;;;Verzekeren/Z_Other/2023-09-08 Premium payment;2085;2023-09-08 00:00:00;2024-03-11 00:00:00;Communication;Consumer Lending & Insurance;Change
;;;;;Fraud/Process change/2023-09-11 Instant Username;2095;2023-09-11 00:00:00;2024-03-21 00:00:00;Risk assessment (non-PAP);Tribe Fraud & Cyber Security;Change
;;;;;Persoonlijke Lening/Persoonlijke Lening/2023-09-20 Implementing external consolidation;2130;2023-09-20 00:00:00;2025-01-17 00:00:00;Risk assessment (non-PAP);Consumer Lending & Insurance;Change
;;;;;KYC/Process change/2023-09-21 Make sanctions questionnaire available via a hidden direct link;2135;2023-09-21 00:00:00;2024-10-23 00:00:00;Risk assessment (non-PAP);Tribe KYC Services;Change
;;;;;Beleggingsrekeningen/Eenvoudig Beleggen/2023-09-26 Feature 3904463 OpSafe investing campaign;2138;2023-09-26 00:00:00;2024-12-17 00:00:00;Significant change financial product/-service/channel (PAP);Tribe Investments;Change
;;;;;Payments Mobile Payments/Mobiel Betalen/2023-09-26 Mobile card Icons;2142;2023-09-26 00:00:00;2024-10-07 00:00:00;Other change (non-PAP);Tribe Payments;Change
;;;;;Customer Data/Process change/2023-09-27 Improve process change of address for non digital clients;2147;2023-09-27 00:00:00;2025-02-14 00:00:00;Other change (non-PAP);Tribe Digital Business Banking;Change
;;;;;Verzekeren/Z_Other/2023-09-28 NN Call Centre FEC check;2148;2023-09-28 00:00:00;2024-02-02 00:00:00;Other change (non-PAP);Consumer Lending & Insurance;Change
;;;;;Hypotheken/Z_Other/2023-09-29 Data sharing  Consent;2152;2023-09-29 00:00:00;2024-05-14 00:00:00;Risk assessment (non-PAP);Tribe Mortgages;Change
;;;;;Lenen zakelijk/New product/2023-09-29 ING CheckAhead Referral Module;2153;2023-09-29 00:00:00;2024-03-07 00:00:00;Other change (non-PAP);Tribe Business Lending;Change
;;;;;Doorlopend Krediet/Z_Other/2023-10-02 risklog update Lapwing Q3Q4 2023;2157;2023-10-02 00:00:00;2024-02-16 00:00:00;Risk assessment (non-PAP);Consumer Lending & Insurance;Change
;;;;;Hypotheken/Overbruggingshypotheek/2023-10-03 collection of bridging mortgage;2160;2023-10-03 00:00:00;2024-02-16 00:00:00;Communication;Tribe Mortgages;Change
;;;;;Hypotheken/Maatwerkhypotheek/2023-10-03 Communicatie Life Cycle ING Maatwerk Hypotheek;2163;2023-10-03 00:00:00;2024-02-12 00:00:00;Communication;Tribe Mortgages;Change
;;;;;Z_Other/Tribe Business Lending/2023-10-04 GZ Attach for material modifications in MidCorps;2165;2023-10-04 00:00:00;2024-02-28 00:00:00;Other change (non-PAP);Tribe Business Lending;Change
;;;;;Z_Other/Tribe Business Lending/2023-10-04 Implementation of updated Review Policy;2166;2023-10-04 00:00:00;2024-02-28 00:00:00;Other change (non-PAP);Tribe Business Lending;Change
;;;;;HR Processes & Systems/Other/2023-10-05 LTO WFT MIFID Lindehaege;2169;2023-10-05 00:00:00;2024-02-05 00:00:00;Other change (non-PAP);People Services;Change
;;;;;Beleggingsrekeningen/Z_Other/2023-10-05 Aladdin;2170;2023-10-05 00:00:00;2024-04-24 00:00:00;Risk assessment (non-PAP);Tribe Investments;Change
